{
    "order_id": "O-100",
    "customer": { "country_code": "DK", "is_b2b": false },
    "items": [
        { "type": "physical", "gross_amount": "125.00", "vat_amount": "25.00", "vat_rate": "0.25" },
        { "type": "shipping", "gross_amount": "50.00", "vat_amount": "10.00", "vat_rate": "0.25" },
        { "type": "fee", "gross_amount": "20.00", "vat_amount": "4.00", "vat_rate": "0.25" },
        { "type": "giftwrapping", "gross_amount": "15.00", "vat_amount": "3.00", "vat_rate": "0.25" }
    ],
    "currency": "DKK",
    "invoice_number": "INV-2026-0001"
}
